### ISSUE TITLE
Scan not working

### ISSUE THREAD

**Issue by danielkucera** [john30/ebusd-configuration#68]
Hi,

I'm trying to scan bus devices but nothing is going on:
```
# ebusd --scanconfig --device=192.168.0.192:23 --latency=10000 -f
2017-10-10 20:22:50.975 [main notice] ebusd 3.0.v3.0-9-gb9c69f0 started with broadcast scan
2017-10-10 20:22:50.984 [bus notice] bus started with own address 31/36
```
when I capture packets, nothing is sent to the bus (all packets have 0 length, just the connection works):
```
20:22:50.981027 IP 192.168.0.254.43158 > 192.168.0.192.23: Flags [S], seq 4042384158, win 14600, options [mss 1460,sackOK,TS val 121557936 ecr 0,nop,wscale 7], length 0
	0x0000:  4500 003c 30ae 4000 4006 86ff c0a8 00fe  E..<0.@.@.......
	0x0010:  c0a8 00c0 a896 0017 f0f1 e31e 0000 0000  ................
	0x0020:  a002 3908 833d 0000 0204 05b4 0402 080a  ..9..=..........
	0x0030:  073e d3b0 0000 0000 0103 0307            .>..........
20:22:50.983711 IP 192.168.0.192.23 > 192.168.0.254.43158: Flags [S.], seq 909645, ack 4042384159, win 2144, options [mss 536], length 0
	0x0000:  4500 002c 0757 0000 8006 b066 c0a8 00c0  E..,.W.....f....
	0x0010:  c0a8 00fe 0017 a896 000d e14d f0f1 e31f  ...........M....
	0x0020:  6012 0860 b229 0000 0204 0218 2020       `..`.)........
20:22:50.983828 IP 192.168.0.254.43158 > 192.168.0.192.23: Flags [.], ack 1, win 14600, length 0
	0x0000:  4500 0028 30af 4000 4006 8712 c0a8 00fe  E..(0.@.@.......
	0x0010:  c0a8 00c0 a896 0017 f0f1 e31f 000d e14e  ...............N
	0x0020:  5010 3908 8329 0000                      P.9..)..
```
How can I actively scan devices on bus?

**Comment by danielkucera** [comment]
even `scan full` doesn't send anything:

```
2017-10-10 21:28:16.956 [network info] [00008] client connection opened 127.0.0.1
2017-10-10 21:28:16.956 [network debug] [00008] wait for result
2017-10-10 21:28:16.956 [main debug] performing regular tasks
2017-10-10 21:28:16.957 [main debug] >>> scan full
2017-10-10 21:28:16.958 [bus info] scan 02 cmd: 3102070400
2017-10-10 21:28:16.958 [main debug] <<< done
2017-10-10 21:28:16.961 [network info] [00008] connection closed
2017-10-10 21:28:17.204 [bus info] scan 04 cmd: 3104070400
2017-10-10 21:28:17.205 [bus info] scan 05 cmd: 3105070400
2017-10-10 21:28:17.205 [bus info] scan 06 cmd: 3106070400
2017-10-10 21:28:17.205 [bus info] scan 08 cmd: 3108070400
2017-10-10 21:28:17.205 [bus info] scan 09 cmd: 3109070400
2017-10-10 21:28:17.206 [bus info] scan 0a cmd: 310a070400
2017-10-10 21:28:17.206 [bus info] scan 0b cmd: 310b070400
2017-10-10 21:28:17.206 [bus info] scan 0c cmd: 310c070400
2017-10-10 21:28:17.206 [bus info] scan 0d cmd: 310d070400
2017-10-10 21:28:17.207 [bus info] scan 0e cmd: 310e070400
2017-10-10 21:28:17.207 [bus info] scan 12 cmd: 3112070400
2017-10-10 21:28:17.207 [bus info] scan 14 cmd: 3114070400
2017-10-10 21:28:17.207 [bus info] scan 15 cmd: 3115070400
2017-10-10 21:28:17.208 [bus info] scan 16 cmd: 3116070400
2017-10-10 21:28:17.208 [bus info] scan 18 cmd: 3118070400
2017-10-10 21:28:17.208 [bus info] scan 19 cmd: 3119070400
2017-10-10 21:28:17.209 [bus info] scan 1a cmd: 311a070400
2017-10-10 21:28:17.209 [bus info] scan 1b cmd: 311b070400
2017-10-10 21:28:17.209 [bus info] scan 1c cmd: 311c070400
2017-10-10 21:28:17.209 [bus info] scan 1d cmd: 311d070400
2017-10-10 21:28:17.210 [bus info] scan 1e cmd: 311e070400
2017-10-10 21:28:17.210 [bus info] scan 20 cmd: 3120070400
2017-10-10 21:28:17.210 [bus info] scan 21 cmd: 3121070400
2017-10-10 21:28:17.210 [bus info] scan 22 cmd: 3122070400
2017-10-10 21:28:17.211 [bus info] scan 23 cmd: 3123070400
2017-10-10 21:28:17.211 [bus info] scan 24 cmd: 3124070400
2017-10-10 21:28:17.211 [bus info] scan 25 cmd: 3125070400
2017-10-10 21:28:17.211 [bus info] scan 26 cmd: 3126070400
2017-10-10 21:28:17.212 [bus info] scan 27 cmd: 3127070400
2017-10-10 21:28:17.212 [bus info] scan 28 cmd: 3128070400
2017-10-10 21:28:17.212 [bus info] scan 29 cmd: 3129070400
2017-10-10 21:28:17.213 [bus info] scan 2a cmd: 312a070400
2017-10-10 21:28:17.213 [bus info] scan 2b cmd: 312b070400
2017-10-10 21:28:17.213 [bus info] scan 2c cmd: 312c070400
2017-10-10 21:28:17.213 [bus info] scan 2d cmd: 312d070400
2017-10-10 21:28:17.214 [bus info] scan 2e cmd: 312e070400
2017-10-10 21:28:17.214 [bus info] scan 2f cmd: 312f070400
2017-10-10 21:28:17.214 [bus info] scan 32 cmd: 3132070400
2017-10-10 21:28:17.214 [bus info] scan 34 cmd: 3134070400
2017-10-10 21:28:17.215 [bus info] scan 35 cmd: 3135070400
2017-10-10 21:28:17.215 [bus info] scan 36 cmd: 3136070400
2017-10-10 21:28:17.215 [bus info] scan 38 cmd: 3138070400
2017-10-10 21:28:17.215 [bus info] scan 39 cmd: 3139070400
2017-10-10 21:28:17.216 [bus info] scan 3a cmd: 313a070400
2017-10-10 21:28:17.216 [bus info] scan 3b cmd: 313b070400
2017-10-10 21:28:17.216 [bus info] scan 3c cmd: 313c070400
2017-10-10 21:28:17.216 [bus info] scan 3d cmd: 313d070400
2017-10-10 21:28:17.217 [bus info] scan 3e cmd: 313e070400
2017-10-10 21:28:17.217 [bus info] scan 40 cmd: 3140070400
2017-10-10 21:28:17.217 [bus info] scan 41 cmd: 3141070400
2017-10-10 21:28:17.217 [bus info] scan 42 cmd: 3142070400
2017-10-10 21:28:17.218 [bus info] scan 43 cmd: 3143070400
2017-10-10 21:28:17.218 [bus info] scan 44 cmd: 3144070400
2017-10-10 21:28:17.218 [bus info] scan 45 cmd: 3145070400
2017-10-10 21:28:17.218 [bus info] scan 46 cmd: 3146070400
2017-10-10 21:28:17.219 [bus info] scan 47 cmd: 3147070400
2017-10-10 21:28:17.219 [bus info] scan 48 cmd: 3148070400
2017-10-10 21:28:17.219 [bus info] scan 49 cmd: 3149070400
2017-10-10 21:28:17.219 [bus info] scan 4a cmd: 314a070400
2017-10-10 21:28:17.220 [bus info] scan 4b cmd: 314b070400
2017-10-10 21:28:17.220 [bus info] scan 4c cmd: 314c070400
2017-10-10 21:28:17.220 [bus info] scan 4d cmd: 314d070400
2017-10-10 21:28:17.220 [bus info] scan 4e cmd: 314e070400
2017-10-10 21:28:17.221 [bus info] scan 4f cmd: 314f070400
2017-10-10 21:28:17.221 [bus info] scan 50 cmd: 3150070400
2017-10-10 21:28:17.221 [bus info] scan 51 cmd: 3151070400
2017-10-10 21:28:17.221 [bus info] scan 52 cmd: 3152070400
2017-10-10 21:28:17.222 [bus info] scan 53 cmd: 3153070400
2017-10-10 21:28:17.222 [bus info] scan 54 cmd: 3154070400
2017-10-10 21:28:17.222 [bus info] scan 55 cmd: 3155070400
2017-10-10 21:28:17.222 [bus info] scan 56 cmd: 3156070400
2017-10-10 21:28:17.223 [bus info] scan 57 cmd: 3157070400
2017-10-10 21:28:17.223 [bus info] scan 58 cmd: 3158070400
2017-10-10 21:28:17.223 [bus info] scan 59 cmd: 3159070400
2017-10-10 21:28:17.223 [bus info] scan 5a cmd: 315a070400
2017-10-10 21:28:17.224 [bus info] scan 5b cmd: 315b070400
2017-10-10 21:28:17.224 [bus info] scan 5c cmd: 315c070400
2017-10-10 21:28:17.224 [bus info] scan 5d cmd: 315d070400
2017-10-10 21:28:17.224 [bus info] scan 5e cmd: 315e070400
2017-10-10 21:28:17.225 [bus info] scan 5f cmd: 315f070400
2017-10-10 21:28:17.225 [bus info] scan 60 cmd: 3160070400
2017-10-10 21:28:17.225 [bus info] scan 61 cmd: 3161070400
2017-10-10 21:28:17.225 [bus info] scan 62 cmd: 3162070400
2017-10-10 21:28:17.226 [bus info] scan 63 cmd: 3163070400
2017-10-10 21:28:17.226 [bus info] scan 64 cmd: 3164070400
2017-10-10 21:28:17.226 [bus info] scan 65 cmd: 3165070400
2017-10-10 21:28:17.226 [bus info] scan 66 cmd: 3166070400
2017-10-10 21:28:17.227 [bus info] scan 67 cmd: 3167070400
2017-10-10 21:28:17.227 [bus info] scan 68 cmd: 3168070400
2017-10-10 21:28:17.227 [bus info] scan 69 cmd: 3169070400
2017-10-10 21:28:17.227 [bus info] scan 6a cmd: 316a070400
2017-10-10 21:28:17.228 [bus info] scan 6b cmd: 316b070400
2017-10-10 21:28:17.228 [bus info] scan 6c cmd: 316c070400
2017-10-10 21:28:17.228 [bus info] scan 6d cmd: 316d070400
2017-10-10 21:28:17.228 [bus info] scan 6e cmd: 316e070400
2017-10-10 21:28:17.229 [bus info] scan 6f cmd: 316f070400
2017-10-10 21:28:17.229 [bus info] scan 72 cmd: 3172070400
2017-10-10 21:28:17.229 [bus info] scan 74 cmd: 3174070400
2017-10-10 21:28:17.229 [bus info] scan 75 cmd: 3175070400
2017-10-10 21:28:17.230 [bus info] scan 76 cmd: 3176070400
2017-10-10 21:28:17.230 [bus info] scan 78 cmd: 3178070400
2017-10-10 21:28:17.230 [bus info] scan 79 cmd: 3179070400
2017-10-10 21:28:17.230 [bus info] scan 7a cmd: 317a070400
2017-10-10 21:28:17.231 [bus info] scan 7b cmd: 317b070400
2017-10-10 21:28:17.231 [bus info] scan 7c cmd: 317c070400
2017-10-10 21:28:17.231 [bus info] scan 7d cmd: 317d070400
2017-10-10 21:28:17.231 [bus info] scan 7e cmd: 317e070400
2017-10-10 21:28:17.232 [bus info] scan 80 cmd: 3180070400
2017-10-10 21:28:17.232 [bus info] scan 81 cmd: 3181070400
2017-10-10 21:28:17.232 [bus info] scan 82 cmd: 3182070400
2017-10-10 21:28:17.232 [bus info] scan 83 cmd: 3183070400
2017-10-10 21:28:17.233 [bus info] scan 84 cmd: 3184070400
2017-10-10 21:28:17.233 [bus info] scan 85 cmd: 3185070400
2017-10-10 21:28:17.233 [bus info] scan 86 cmd: 3186070400
2017-10-10 21:28:17.233 [bus info] scan 87 cmd: 3187070400
2017-10-10 21:28:17.234 [bus info] scan 88 cmd: 3188070400
2017-10-10 21:28:17.234 [bus info] scan 89 cmd: 3189070400
2017-10-10 21:28:17.234 [bus info] scan 8a cmd: 318a070400
2017-10-10 21:28:17.234 [bus info] scan 8b cmd: 318b070400
2017-10-10 21:28:17.235 [bus info] scan 8c cmd: 318c070400
2017-10-10 21:28:17.235 [bus info] scan 8d cmd: 318d070400
2017-10-10 21:28:17.235 [bus info] scan 8e cmd: 318e070400
2017-10-10 21:28:17.235 [bus info] scan 8f cmd: 318f070400
2017-10-10 21:28:17.236 [bus info] scan 90 cmd: 3190070400
2017-10-10 21:28:17.236 [bus info] scan 91 cmd: 3191070400
2017-10-10 21:28:17.236 [bus info] scan 92 cmd: 3192070400
2017-10-10 21:28:17.236 [bus info] scan 93 cmd: 3193070400
2017-10-10 21:28:17.237 [bus info] scan 94 cmd: 3194070400
2017-10-10 21:28:17.237 [bus info] scan 95 cmd: 3195070400
2017-10-10 21:28:17.237 [bus info] scan 96 cmd: 3196070400
2017-10-10 21:28:17.237 [bus info] scan 97 cmd: 3197070400
2017-10-10 21:28:17.238 [bus info] scan 98 cmd: 3198070400
2017-10-10 21:28:17.238 [bus info] scan 99 cmd: 3199070400
2017-10-10 21:28:17.238 [bus info] scan 9a cmd: 319a070400
2017-10-10 21:28:17.238 [bus info] scan 9b cmd: 319b070400
2017-10-10 21:28:17.239 [bus info] scan 9c cmd: 319c070400
2017-10-10 21:28:17.239 [bus info] scan 9d cmd: 319d070400
2017-10-10 21:28:17.239 [bus info] scan 9e cmd: 319e070400
2017-10-10 21:28:17.240 [bus info] scan 9f cmd: 319f070400
2017-10-10 21:28:17.240 [bus info] scan a0 cmd: 31a0070400
2017-10-10 21:28:17.240 [bus info] scan a1 cmd: 31a1070400
2017-10-10 21:28:17.240 [bus info] scan a2 cmd: 31a2070400
2017-10-10 21:28:17.241 [bus info] scan a3 cmd: 31a3070400
2017-10-10 21:28:17.241 [bus info] scan a4 cmd: 31a4070400
2017-10-10 21:28:17.241 [bus info] scan a5 cmd: 31a5070400
2017-10-10 21:28:17.242 [bus info] scan a6 cmd: 31a6070400
2017-10-10 21:28:17.242 [bus info] scan a7 cmd: 31a7070400
2017-10-10 21:28:17.242 [bus info] scan a8 cmd: 31a8070400
2017-10-10 21:28:17.242 [bus info] scan ab cmd: 31ab070400
2017-10-10 21:28:17.243 [bus info] scan ac cmd: 31ac070400
2017-10-10 21:28:17.243 [bus info] scan ad cmd: 31ad070400
2017-10-10 21:28:17.243 [bus info] scan ae cmd: 31ae070400
2017-10-10 21:28:17.243 [bus info] scan af cmd: 31af070400
2017-10-10 21:28:17.244 [bus info] scan b0 cmd: 31b0070400
2017-10-10 21:28:17.244 [bus info] scan b1 cmd: 31b1070400
2017-10-10 21:28:17.244 [bus info] scan b2 cmd: 31b2070400
2017-10-10 21:28:17.244 [bus info] scan b3 cmd: 31b3070400
2017-10-10 21:28:17.245 [bus info] scan b4 cmd: 31b4070400
2017-10-10 21:28:17.245 [bus info] scan b5 cmd: 31b5070400
2017-10-10 21:28:17.245 [bus info] scan b6 cmd: 31b6070400
2017-10-10 21:28:17.245 [bus info] scan b7 cmd: 31b7070400
2017-10-10 21:28:17.246 [bus info] scan b8 cmd: 31b8070400
2017-10-10 21:28:17.246 [bus info] scan b9 cmd: 31b9070400
2017-10-10 21:28:17.246 [bus info] scan ba cmd: 31ba070400
2017-10-10 21:28:17.246 [bus info] scan bb cmd: 31bb070400
2017-10-10 21:28:17.247 [bus info] scan bc cmd: 31bc070400
2017-10-10 21:28:17.247 [bus info] scan bd cmd: 31bd070400
2017-10-10 21:28:17.247 [bus info] scan be cmd: 31be070400
2017-10-10 21:28:17.247 [bus info] scan bf cmd: 31bf070400
2017-10-10 21:28:17.248 [bus info] scan c0 cmd: 31c0070400
2017-10-10 21:28:17.248 [bus info] scan c1 cmd: 31c1070400
2017-10-10 21:28:17.248 [bus info] scan c2 cmd: 31c2070400
2017-10-10 21:28:17.248 [bus info] scan c3 cmd: 31c3070400
2017-10-10 21:28:17.248 [bus info] scan c4 cmd: 31c4070400
2017-10-10 21:28:17.249 [bus info] scan c5 cmd: 31c5070400
2017-10-10 21:28:17.249 [bus info] scan c6 cmd: 31c6070400
2017-10-10 21:28:17.249 [bus info] scan c7 cmd: 31c7070400
2017-10-10 21:28:17.249 [bus info] scan c8 cmd: 31c8070400
2017-10-10 21:28:17.250 [bus info] scan c9 cmd: 31c9070400
2017-10-10 21:28:17.250 [bus info] scan ca cmd: 31ca070400
2017-10-10 21:28:17.250 [bus info] scan cb cmd: 31cb070400
2017-10-10 21:28:17.250 [bus info] scan cc cmd: 31cc070400
2017-10-10 21:28:17.251 [bus info] scan cd cmd: 31cd070400
2017-10-10 21:28:17.251 [bus info] scan ce cmd: 31ce070400
2017-10-10 21:28:17.251 [bus info] scan cf cmd: 31cf070400
2017-10-10 21:28:17.252 [bus info] scan d0 cmd: 31d0070400
2017-10-10 21:28:17.252 [bus info] scan d1 cmd: 31d1070400
2017-10-10 21:28:17.252 [bus info] scan d2 cmd: 31d2070400
2017-10-10 21:28:17.253 [bus info] scan d3 cmd: 31d3070400
2017-10-10 21:28:17.253 [bus info] scan d4 cmd: 31d4070400
2017-10-10 21:28:17.253 [bus info] scan d5 cmd: 31d5070400
2017-10-10 21:28:17.254 [bus info] scan d6 cmd: 31d6070400
2017-10-10 21:28:17.254 [bus info] scan d7 cmd: 31d7070400
2017-10-10 21:28:17.254 [bus info] scan d8 cmd: 31d8070400
2017-10-10 21:28:17.254 [bus info] scan d9 cmd: 31d9070400
2017-10-10 21:28:17.255 [bus info] scan da cmd: 31da070400
2017-10-10 21:28:17.255 [bus info] scan db cmd: 31db070400
2017-10-10 21:28:17.255 [bus info] scan dc cmd: 31dc070400
2017-10-10 21:28:17.255 [bus info] scan dd cmd: 31dd070400
2017-10-10 21:28:17.256 [bus info] scan de cmd: 31de070400
2017-10-10 21:28:17.256 [bus info] scan df cmd: 31df070400
2017-10-10 21:28:17.256 [bus info] scan e0 cmd: 31e0070400
2017-10-10 21:28:17.256 [bus info] scan e1 cmd: 31e1070400
2017-10-10 21:28:17.257 [bus info] scan e2 cmd: 31e2070400
2017-10-10 21:28:17.257 [bus info] scan e3 cmd: 31e3070400
2017-10-10 21:28:17.257 [bus info] scan e4 cmd: 31e4070400
2017-10-10 21:28:17.257 [bus info] scan e5 cmd: 31e5070400
2017-10-10 21:28:17.258 [bus info] scan e6 cmd: 31e6070400
2017-10-10 21:28:17.258 [bus info] scan e7 cmd: 31e7070400
2017-10-10 21:28:17.258 [bus info] scan e8 cmd: 31e8070400
2017-10-10 21:28:17.258 [bus info] scan e9 cmd: 31e9070400
2017-10-10 21:28:17.259 [bus info] scan ea cmd: 31ea070400
2017-10-10 21:28:17.259 [bus info] scan eb cmd: 31eb070400
2017-10-10 21:28:17.259 [bus info] scan ec cmd: 31ec070400
2017-10-10 21:28:17.259 [bus info] scan ed cmd: 31ed070400
2017-10-10 21:28:17.260 [bus info] scan ee cmd: 31ee070400
2017-10-10 21:28:17.260 [bus info] scan ef cmd: 31ef070400
2017-10-10 21:28:17.260 [bus info] scan f2 cmd: 31f2070400
2017-10-10 21:28:17.260 [bus info] scan f4 cmd: 31f4070400
2017-10-10 21:28:17.261 [bus info] scan f5 cmd: 31f5070400
2017-10-10 21:28:17.261 [bus info] scan f6 cmd: 31f6070400
2017-10-10 21:28:17.261 [bus info] scan f8 cmd: 31f8070400
2017-10-10 21:28:17.261 [bus info] scan f9 cmd: 31f9070400
2017-10-10 21:28:17.262 [bus info] scan fa cmd: 31fa070400
2017-10-10 21:28:17.262 [bus info] scan fb cmd: 31fb070400
2017-10-10 21:28:17.262 [bus info] scan fc cmd: 31fc070400
2017-10-10 21:28:17.262 [bus info] scan fd cmd: 31fd070400
2017-10-10 21:28:17.958 [network debug] dead connection removed - 0
2017-10-10 21:28:26.959 [main debug] performing regular tasks
```

**Comment by john30** [comment]
not an ebusd-configuration issue, but anyway:
guess that depends on the device you are using. since you specified port 23 (which is rather unusual), I assume this is some kind of network-serial bridge. which one exactly?

**Comment by danielkucera** [comment]
I use esp8266 with my own circuit design and I only have boiler and my esp on the bus, no controller. But I've found out that there are some pulses on the bus which I don't see in TCP connection so there is some hw bug and I'm going to rebuild my converter.

Anyway, could you please explain in documentation how does the scan work? If it just listens or it also sends some messages to bus to actively poll devices?

**Comment by danielkucera** [comment]
As software I use esp-link.

**Comment by john30** [comment]
it won't work reliably with esp-link because the timing needed for eBUS access is ruined by esplink. you could try with additional ebusd start parameter "--latency=100000" though.
there is a dedicated message defined by eBUS specification to query the ID of a slave. in scan config ebusd uses this message actively to scan all or just the already seen slaves in order to find the best matching CSV for that. it is explained here:
https://github.com/john30/ebusd/wiki/4.6.-Scanning
https://github.com/john30/ebusd/wiki/4.7.-Automatic-configuration

**Comment by danielkucera** [comment]
I doubt esp is not fast enough: while there is one byte transmitted on bus, esp can send doezns of packets (2400bps vs 54Mbps) - if it doesnt work for someone it may be caused by some incorrectly set buffering.

Of course I've read the documentation but it is not very clearly writen. I would expect something like: 
With --scanconfig ebusd just listens on bus and waits for messages. After receiving a message from device with new bus address it sends probe message ....
But now I understand the principle.

But there is the issue with scan full: it throws the message as I pasted above but nothing is sent to tcp connection...

**Comment by john30** [comment]
the problem is the latency. each symbol on the bus is supposed to take just 5ms and with wifi and ESP in between this is increased to around 20ms.
regarding the tcp connection issue: i guess the telnet port on the esp firmware you are using is waiting for a cr/linefeed input before the packet is transmitted. that's why a "telnet" port is not good for ebus purposes.

**Comment by john30** [comment]
meanwhile i started building a firmware for esp8266 that avoids any possible latency between network and serial port, [see here for details](https://github.com/john30/ebusd-esp)

**Comment by danielkucera** [comment]
Awesome... Are going to release sources? I'm building esp module powered from ebus. But still waiting for the esp module...
![img_20171023_095145](https://user-images.githubusercontent.com/1734256/31877967-bf3d10b0-b7d8-11e7-82aa-5289d491e603.jpg)
![img_20171023_095150](https://user-images.githubusercontent.com/1734256/31877969-bf63b4c2-b7d8-11e7-893a-43df7867919b.jpg)

**Comment by john30** [comment]
not sure yet :-) We are in the process of building a new eBUS interface that also allows to use a Wemos D1 mini, [see here](https://forum.fhem.de/index.php?topic=75878)
 I'm not sure if we'll power it by eBUS because the specification is very restrictive regarding the power consumption.

**Comment by danielkucera** [comment]
Could you please look on my capture and log and check why does it not work? Is it really because of the latency? Thank you.
[log.txt](https://github.com/john30/ebusd-configuration/files/1424457/log.txt)

[ebus.zip](https://github.com/john30/ebusd-configuration/files/1424458/ebus.zip)

**Comment by danielkucera** [comment]
Ok, now I've read "eBus background" and feel stupid for arguing with you about that timing. I'll try to handle messages on esp to ensure right timing and bus access.

**Comment by szczukot** [comment]
John30 - how is it works (bin for ESP) ?
Can I flashthis bin to wemos (or other esp module), and on UDP i will see data from eBus ?
But when i connecting GPIO ? To this converter https://wiki.fhem.de/wiki/EBUS ?
Maybe add to configuration info counter about receive and transmit frame? You can check it quickly if it (connecting etc)  works properly or not.

**Comment by john30** [comment]
yes you can flash the binary on wemos, see the [readme](https://github.com/john30/ebusd-esp/blob/master/README.md)

**Comment by szczukot** [comment]
And what's next ?
What is connect to GPIO ?

**Comment by john30** [comment]
next thing on todo list is to add http server for easy re-configuration. then add support for i2c sensors, oled and stuff like that. right now you can only use configurable pins for rx/tx traffic indication.

**Comment by szczukot** [comment]
:)
Ok, but  Dont understood how is it works. Rx and TX Is connected to ebusd->rs232 converter ?

**Comment by john30** [comment]
you can choose in the configuration menu of the firmware between normal and swapped UART mode. for swapped mode you need to pay attention to the internal pulldown resistor on the TX pin of wemos.

**Comment by szczukot** [comment]
But what do i have to connect to RX and TX ?? This converter https://wiki.fhem.de/wiki/EBUS  through logic level converter (3,3v <-> 5V) ?

**Comment by john30** [comment]
yes, you have to have a hardware interface to eBUS. we're just about to order a good bunch of parts for the new 2.0 adapter, see here:  https://forum.fhem.de/index.php?topic=79427.new
it is in German, though
